user_id,image_paths,user_claim,claim_object,evidence_standard_met,evidence_standard_met_reason,risk_flags,issue_type,object_part,claim_status,claim_status_justification,supporting_image_ids,valid_image,severity
user_001,images/sample/case_s01/img_1_door_scratch.jpg;images/sample/case_s01/img_2_door_context.jpg,User: My car door got scratched in parking.\nAgent: Can you share a photo?\nUser: Here are two pictures of the scratch on the driver door.,car,true,Image evidence meets requirement: Close-up showing dent or scratch with surrounding body panel context,none,scratch,door,supported,Image evidence supports the claim of scratch on door. img_1: scratch visible; img_2: door context,img_1;img_2,true,low
user_002,images/sample/case_s02/img_1_bumper_dent.jpg,User: Front bumper has a big dent from a fender bender.\nAgent: Please upload bumper photos.\nUser: Attached one photo.,car,true,Image evidence meets requirement: Close-up showing dent or scratch with surrounding body panel context,none,dent,front_bumper,supported,Image evidence supports the claim of dent on front_bumper. img_1: dent on bumper,img_1,true,medium
user_004,images/sample/case_s03/img_1_screen_crack.jpg,User: Laptop screen cracked when bag fell.\nAgent: Send screen photo.\nUser: Here is the cracked screen.,laptop,true,Image evidence meets requirement: Screen image showing crack pattern; lid open if possible,none,crack,screen,supported,Image evidence supports the claim of crack on screen. img_1: crack on screen,img_1,true,high
user_006,images/sample/case_s04/img_1_box_crush.jpg;images/sample/case_s04/img_2_box_corner.jpg,User: Package arrived crushed.\nAgent: Photos of box?\nUser: Two angles of crushed corners.,package,true,Image evidence meets requirement: Multiple angles showing crushed box corners and contents if opened,none,crushed_packaging,box,supported,Image evidence supports crushed packaging on box. img_1 and img_2 show crushed corners,img_1;img_2,true,medium
user_001,images/sample/case_s05/img_1_door_clean.jpg,User: Door is badly scratched.\nAgent: Photo of scratch?\nUser: See attached.,car,true,Image evidence meets requirement: Close-up showing dent or scratch with surrounding body panel context,claim_mismatch,none,door,contradicted,Images img_1 show no visible damage on the claimed part.,img_1,true,none
user_003,images/sample/case_s06/img_1_blur.jpg,User: Windshield shattered.\nAgent: Clear photo needed.\nUser: This is all I have.,car,false,No usable images for automated review,blurry_image;damage_not_visible,unknown,unknown,not_enough_information,Submitted images are not usable for automated review.,none,false,unknown
